,title,text,time,image,country,3let
39," Αλβανία: Παραιτήθηκε ο Υπουργός Εσωτερικών, πρώτη νίκη των διαδηλωτών ",Η λαϊκή απαίτηση για παραίτηση του Υπουργού Εσωτερικών στην Αλβανία έγινε πράξη. Ο Ράμα θα την ενεργοποιήσει μόλις επιστρέψει από τις ΗΠΑ. ,2020-12-10 19:52:00,https://www.news247.gr/img/2948/9076074/441000/w140/140/albania2.jpg,αλβανία,ALB
43, Φινλανδία: Αυξημένα επίπεδα ραδιενέργειας μέσα σε πυρηνικό σταθμό ,Αυξήθηκαν τα επίπεδα ραδιενέργειας μέσα στη Μονάδα 2 του Πυρηνικού Σταθμού Olkiluoto. Πρόκειται για ένα ασυνήθιστο περιστατικό. Δεν υπήρξε διαρροή.,2020-12-10 18:44:00,https://www.news247.gr/img/836/9076983/459000/w140/140/finlandia.jpg,φινλανδία,FIN
44, Γαλλία: Ο υπουργός Ευρωπαϊκών Υποθέσεων έκανε coming out ως γκέι ,"Ο Clément Beaune έκανε coming out ως γκέι. Υποσχέθηκε ότι θα υποστηρίξει την ΛΟΑΤΚΙ κοινότητα της Πολωνίας, που στιγματίζεται έντονα.",2020-12-10 14:39:00,https://www.news247.gr/img/7444/9076720/909000/w140/140/cl,γαλλία,FRA
45, Ιταλία-κορονοϊός: 4χρονο αγόρι είχε νοσήσει από το Νοέμβριο του 2019 ,"Νέα έρευνα αποκαλύπτει ότι ιός είχε εξαπλωθεί σε όλο τον κόσμο πριν γίνει γνωστός, αφού ένα παιδί στο Μιλάνο, εξακριβώθηκε ότι νόσησε από κορονοϊό ήδη από τον Νοέμβριο του 2019, χωρίς να έχει ταξιδέψει εκτός Ιταλίας. ",2020-12-10 14:03:00,https://www.news247.gr/img/1164/9076603/578000/w140/140/boy_mask.jpg,ιταλία,ITA
46," Ιταλία: ""Βούλιαξε"" και πάλι η Βενετία ","Η έντονη κακοκαιρία βρήκε απροετοίμαστους τους Ιταλούς. Δε λειτούργησε το σύστημα φραγμάτων, με αποτέλεσμα να δημιουργηθούν τεράστια προβλήματα.",2020-12-10 13:42:00,https://www.news247.gr/img/9804/9076669/773000/w140/140/venice.jpg,ιταλία,ITA
48, Ελληνικό κράνος του 7ου αιώνα π.Χ. εντοπίστηκε σε τάφο πολεμιστή στην Κροατία ,"Ελληνικό κράνος που χρησιμοποιήθηκε στους Περσικούς Πολέμους έφεραν στο φως αρχαιολόγοι στην Κροατία, μαζί με άλλα σπουδαία κειμήλια.",2020-12-10 12:00:00,https://www.news247.gr/img/1451/9076542/185000/w140/140/kranos.jpg,κροατία,HRV
40," Δολοφονία 25χρονου στην Αλβανία: ""Απαιτούμε δικαιοσύνη"" λέει ο πατέρας του ","Σε αναβρασμό βρίσκεται η γειτονική Αλβανία έπειτα από τη δολοφονία 25χρονου από σφαίρα αστυνομικού. ""Είμαστε άνθρωποι και απαιτούμε δικαιοσύνη. Πρέπει να λάβουν την τιμωρία που τους αξίζει"", υποστήριξε ο πατέρας του θύματος.",2020-12-10 11:45:00,https://www.news247.gr/img/2948/9076074/441000/w140/140/albania2.jpg,αλβανία,ALB
49, Ιαπωνία: Θα χρηματοδοτήσουν πρόγραμμα εύρεσης συντρόφου μέσω τεχνητής νοημοσύνης ,"Η χρηματοδότηση της ιαπωνικής κυβέρνησης στοχεύει στην αξιοποίηση προηγμένων συστημάτων ζευγαρώματος που θα λαμβάνουν υπόψη παράγοντες όπως χόμπι και αξίες, έχοντας ως στόχο την αύξηση των γεννήσεων στην χώρα.",2020-12-10 11:27:00,https://www.news247.gr/img/6833/9076497/018000/w140/140/japan.jpg,ιαπωνία,JPN
50, Αποκάλυψη που σοκάρει: Ο Τζονς Χόπκινς ήταν ιδιοκτήτης σκλάβων ,"Το πανεπιστήμιο, το οποίο υπήρξε εξαρχής στο προσκήνιο της πληροφόρησης για τον νέο κορονοϊό, ""υπερηφανεύτηκε"" για τον ιδρυτή που φέρεται να ήταν ιδιοκτήτης σκλάβων. ",2020-12-10 11:01:00,https://www.news247.gr/img/9092/9076410/443000/w140/140/hopkins.jpg,ελλάδα,GRC
51," Παραλήρημα από τον Μητροπολίτη Μόρφου: ""Ψηφιοποιημένη ταυτότητα"" τα εμβόλια ","Για ""νέα τάξη πραγμάτων"" κάνει λόγο ο Μητροπολίτης Μόρφου και ξεκαθαρίζει πως οι εκκλησίες της περιφέρειάς του δεν θα κλείσουν ούτε θα υπάρχει συγκεκριμένος αριθμός πιστών μέσα σε αυτές. Τι λέει για τα εμβόλια.",2020-12-10 10:31:00,https://www.news247.gr/img/5419/7495168/715000/w140/140/morfou.jpg,ελλάδα,GRC
56, Κορονοϊός-Βέλγιο: Μεγάλη απάτη με ψεύτικες νοσοκόμες ,"Οι αρχές του Βελγίου προειδοποιούν για καλοστημένη απάτη, στις μέρες του κορονοϊού. Μία νοσοκόμα κάνει τεστ στο θύμα στο μπάνιο, ενώ η δεύτερη νοσοκόμα ψάχνει στο υπόλοιπο σπίτι για χρήματα και τιμαλφή. ",2020-12-10 10:27:00,https://www.news247.gr/img/1866/9076437/531000/w140/140/nurse.jpg,βέλγιο,BEL
52, Τζορτζ Φλόιντ: Η έφηβη που κατέγραψε τη δολοφονία του τιμήθηκε με βραβείο θάρρους ,"Χωρίς την παρουσία και το μυαλό της 17χρονης Darnella, όπως και το ρίσκο να διακινδυνεύσει τη δική της ασφάλεια, ίσως να μην γνωρίζαμε ποτέ την αλήθεια για τη δολοφονία του Τζορτζ Φλόιντ. ",2020-12-10 08:03:00,https://www.news247.gr/img/572/9076336/349000/w140/140/darnella-frazier-.jpg,ελλάδα,GRC
41, Δολοφονία 25χρονου στην Αλβανία: Απενεργοποιημένες οι κάμερες στη στολή του αστυνομικού ,"Απενεργοποιημένη ήταν η κάμερα του αστυνομικού που δολοφόνησε εν ψυχρώ των 25χρονο Klodian Rasha, με αποτέλεσμα ο φόνος να μην καταγραφεί. Θύελλα αντιδράσεων σε όλη τη χώρα.",2020-12-10 07:46:00,https://www.news247.gr/img/8410/9076327/676000/w140/140/alb.jpg,αλβανία,ALB
57, Γερμανία: Όλα έτοιμα για τους μαζικούς εμβολιασμούς ,Πάνω από 8 εκατομμύρια πολίτες αναμένεται να κάνουν το εμβόλιο κατά του κορονοϊού στη Γερμανία. ,2020-12-10 02:26:00,https://www.news247.gr/img/4049/9076172/608000/w140/140/germany.jpg,γερμανία,DEU
53, Ιστορική απόφαση: Ο ΟΗΕ δεν θεωρεί την κάνναβη επικίνδυνη ,"Η απόφαση-ορόσημο του ΟΗΕ αφαιρεί την κάνναβη από τον κατάλογο των επικίνδυνων ουσιών, εκσυγχρονίζοντας το ρυθμιστικό πλαίσιο και ανοίγοντας τον δρόμο στην ανάπτυξη της φαρμακευτικής κάνναβης.",2020-12-10 01:57:00,https://www.news247.gr/img/9329/9075640/638000/w140/140/cannabis.jpg,ελλάδα,GRC
54, Brexit: Συνεχίζεται το αδιέξοδο - Αποχώρησε ο Τζόνσον από τις Βρυξέλλες ,Χωρίς συμφωνία αποχώρησε ο Τζόνσον από τις Βρυξέλλες - Οι συνομιλίες θα συνεχιστούν την Κυριακή. ,2020-12-10 01:30:00,https://www.news247.gr/img/2364/9076273/660000/w140/140/brexit.jpg,ελλάδα,GRC
55, Κυβερνοεπίθεση στον Ευρωπαϊκό Οργανισμό Φαρμάκων με στόχο το εμβόλιο της Pfizer ,Κυβερνοεπίθεση σημειώθηκε στον Ευρωπαϊκό Οργανισμό Φαρμάκων με αποτέλεσμα να υποκλαπούν έγγραφα του εμβολίου της Pfizer. ,2020-12-09 23:46:00,https://www.news247.gr/img/7831/9076146/694000/w140/140/emvolio.jpg,ελλάδα,GRC
42, Αλβανία: Κύμα οργής και σφοδρές συγκρούσεις μετά τη δολοφονία 25χρονου από αστυνομικό ,Εκατοντάδες Αλβανοί βγήκαν στους δρόμους των Τιράνων ζητώντας δικαιοσύνη για τον θάνατο του 25χρονου Klodian Rasha. Βίαια επεισόδια στο κέντρο της πόλης.,2020-12-09 21:53:00,https://www.news247.gr/img/8386/9076073/450000/w140/140/albania1.jpg,αλβανία,ALB
58, ΗΑΕ: Κατά 86% αποτελεσματικό το εμβόλιο κορονοϊού της Κίνας ,Τα ΗΑΕ μεταδίδουν πως το εμβόλιο κατά του κορονοϊού της Εθνικής Φαρμακευτικής Ομάδας της Κίνας είναι αποτελεσματικό κατά 86%. Δεν έχουν κυκλοφορήσει λεπτομερή στοιχεία της κλινικής δοκιμής.,2020-12-09 21:46:00,https://www.news247.gr/img/2351/9076031/277000/w140/140/embolio.jpg,κίνα,CHN
47, Νέα αλλαγή δεδομένων: Ο κορονοϊός ήταν στην Ιταλία από τον Νοέμβριο του 2019 ,"Όλο και νωρίτερα φέρνουν τον κορονοϊό στην Ιταλία μελέτες. Σύμφωνα με την πιο πρόσφατη, είχε φτάσει και είχε αρχίσει να διασπείρεται, τρεις μήνες νωρίτερα από την πρώτη επίσημη καταγραφή κρούσματος. ",2020-12-09 20:59:00,https://www.news247.gr/img/8100/9076045/823000/w140/140/milano091220.jpg,ιταλία,ITA
19, Γαλλία: Βίαια επεισόδια και καταστροφές- 67 αστυνομικοί τραυματίστηκαν ,Βίαιες διαδηλώσεις κατά της αστυνομικής ωμότητας αλλά και του αμφιλεγόμενου νόμου για την ασφάλεια συγκλονίζουν τη Γαλλία.,2020-12-06 18:03:00,https://www.news247.gr/img/1643/9072548/074000/w140/140/9.jpg,γαλλία,FRA
21, Φρανκφούρτη: Χιλιάδες άνθρωποι απομακρύνθηκαν λόγω βόμβας του Β' Παγκοσμίου Πολέμου ,Στην απομάκρυνση σχεδόν 13.000 ανθρώπων υποχρεώθηκαν οι αρχές της Φραγκφούρτης αφού σε περιοχή της πόλης εντοπίστηκε βόμβα του Β' Παγκοσμίου.,2020-12-06 15:43:00,https://www.news247.gr/img/5080/7461052/267000/w140/140/berlin.jpg,ελλάδα,GRC
22," Κορονοϊός: Πάνω από 66 εκατ. κρούσματα και 1,5 εκατ. νεκροί παγκοσμίως ",Συνεχίζεται η επέλαση της πανδημίας του κορονοϊού σε ολόκληρο τον πλανήτη. Συνολικά έχουν χάσει τη ζωή τους μέχρι τώρα 1.529.324 άνθρωποι.,2020-12-06 14:50:00,https://www.news247.gr/img/6291/9072399/610000/w140/140/covid.jpg,ελλάδα,GRC
23, Επιστρέφουν στην Ελλάδα οι Έλληνες ναυτικοί που απήχθησαν από πειρατές στη Νιγηρία ,"Πρόκειται για τον καπετάνιο και δύο μέλη του πληρώματος, τους οποίους απήγαγαν οι πειρατές έπειτα από ρεσάλτο στο δεξαμενόπλοιο ""ΣΤΕΛΙΟΣ Κ"".",2020-12-06 14:27:00,https://www.news247.gr/img/9057/9072400/627000/w140/140/steliosk2.jpg,ελλάδα,GRC
32, Ιταλία: Χαλαρώνουν οι περιορισμοί σε ορισμένες περιφέρειες ,"Δειλά-δειλά, κάποιες ιταλικές περιφέρειες επιχειρούν να ξανανοίξουν μέρος της οικονομικής δραστηριότητας.",2020-12-06 13:28:00,https://www.news247.gr/img/570/9041482/338000/w140/140/italia.jpg,ιταλία,ITA
24, Λονδίνο: Ακραίος συνωστισμός και εικόνες χάους έξω από το Harrods ,"Σκηνές χάους εκτυλίχθηκαν έξω από το πολυκατάστημα Harrods του Λονδίνου. Χιλιάδες Βρετανοί έσπευσαν να ψωνίσουν, χωρίς αποστάσεις και δίχως μάσκες.",2020-12-06 13:25:00,https://www.news247.gr/img/4349/9072353/765000/w140/140/befunky-collage.jpg,ελλάδα,GRC
33, Αυστραλία: Ιστορική στιγμή με τον εθνικό ύμνο να ψάλλεται στη γλώσσα των ιθαγενών ,Για πρώτη φορά ο εθνικός ύμνος της Αυστραλίας ακούστηκε στη γλώσσα των ιθαγενών σε επίσημη περίσταση. ,2020-12-06 11:49:00,https://www.news247.gr/img/8271/9072274/222000/w140/140/australia1.jpg_,αυστραλία,AUS
34," Νέα Ζηλανδία: Καλεί τον κόσμο να κάνει τις απογοητεύσεις του 2020, Δάσος Ελπίδας ",Ο Οργανισμός Τουρισμού της Νέας Ζηλανδίας καλεί ανθρώπους από όλο τον κόσμο να μοιραστούν την απογοήτευσή τους για το 2020 και να εμπνευστούν την αισιοδοξία για το 2021. ,2020-12-06 10:22:00,https://www.news247.gr/img/3034/9006042/856000/w140/140/ap_20145829323360.jpg,νέα ζηλανδία,NZL
35, Ισραήλ: Σκοτώθηκε φανατικός πολέμιος του Νετανιάχου ,"Ο 82χρονος Ντρορ Σόφερ, ορκισμένος εχθρός του Μπέντζαμιν Νετανιάχου, σκοτώθηκε το βράδυ του Σαββάτου στην Ιερουσαλήμ. ",2020-12-06 09:49:00,https://www.news247.gr/img/4048/7686540/846000/w140/140/israel.jpg,ισραήλ,ISR
25, Βρετανία: Την Τρίτη ξεκινά η χορήγηση του εμβολίου κορονοϊού της Pfizer ,Εντός της βδομάδας θα πραγματοποιηθούν οι πρώτες χορηγήσεις του εμβολίου Pfizer στη Βρετανία. Έχει παραγγείλει 40 εκατ. δόσεις. Προτεραιότητα δόθηκε στους άνω των 80 ετών.,2020-12-06 09:25:00,https://www.news247.gr/img/4326/9072219/515000/w140/140/embolio.jpg,ελλάδα,GRC
36, Βολιβία: Άνιες και Καμάτσο καλούνται να λογοδοτήσουν για το πραξικόπημα ,Η κυβέρνηση του Λουίς Αρτσε παραπέμπει τους δύο βασικούς υπεύθυνους για το περσινό πραξικόπημα στη δικαιοσύνη. ,2020-12-06 09:13:00,https://www.news247.gr/img/2394/9023596/015000/w140/140/luisarce.jpg,βολιβία,BOL
26, Η βασίλισσα Ελισάβετ θα κάνει σύντομα το εμβόλιο του κορονοϊού ,"Το βασιλικό ζεύγος θα κάνει εντός των επόμενων εβδομάδων το εμβόλιο της Pfizer-BioNTech, ενθαρρύνοντας και τον υπόλοιπο κόσμο να εμβολιαστεί για τον κορονοϊό.",2020-12-06 07:53:00,https://www.news247.gr/img/8402/9072170/812000/w140/140/eliza.jpg,ελλάδα,GRC
20, Brexit: Συνεχίζουν τις διαπραγματεύσεις Λονδίνο και Βρυξέλλες - Η Γαλλία απειλεί με βέτο ,Η Μεγάλη Βρετανία και η Ευρωπαϊκή Ένωση προσπαθούν να λύσουν τις διαφορές τους στις εμπορικές τους σχέσεις. Η Γαλλία ανησυχεί για το ζήτημα της αλιείας.,2020-12-06 07:50:00,https://www.news247.gr/img/5915/9072169/300000/w140/140/boris-ursula.jpg,γαλλία,FRA
27, Κάψουλα έφερε δείγματα από αστεροειδή που ίσως αποκαλύψουν πώς γεννήθηκε το ηλιακό μας σύστημα ,"Τα δείγματα εντοπίστηκαν μέσα στα κουτιά που είχαν τοποθετηθεί, σε μια έρημο στη νότια Αυστραλία. Τα μισά δείγματα θα μοιραστούν η JAXA, η NASA και διεθνείς οργανισμοί ",2020-12-06 07:50:00,https://www.news247.gr/img/3094/7661892/694000/w140/140/space.jpg,ελλάδα,GRC
28, Αμερικανικές εκλογές: Ο Τραμπ επιμένει ότι θα κερδίσει και συνεχίζει τις καταγγελίες ,"Ο Ντόναλντ Τραμπ βρέθηκε σε προεκλογική συγκέντρωση στην Τζόρτζια και αναφέρθηκε για άλλη μια φορά σε ""νοθεία"". Κάλεσε τον κυβερνήτη να ελέγξει ξανά τα ψηφοδέλτια. ",2020-12-06 07:33:00,https://www.news247.gr/img/1363/9072163/408000/w140/140/trump1.jpg,ελλάδα,GRC
29," Ο μοναδικός άνθρωπος που έχει ""ταφεί"" στο Νότιο πόλο της Σελήνης ","Ό,τι δεν κατάφερε εν ζωή, το πέτυχε με το θάνατο του, με τη NASA να βοηθάει στη ""ταφή"" του στη Σελήνη, αναγνωρίζοντας με αυτό τον τρόπο την πολυετή προσφορά του. ",2020-12-06 07:32:00,https://www.news247.gr/img/303/9071092/825000/w140/140/moon041220.jpg,ελλάδα,GRC
30," Harrods: Ένα φανταχτερό ""αξιοθέατο"" για λίγους ","Το σύνθημα του Harrods είναι η λατινική φράση ""Omnia Omnibus Ubique"", που σημαίνει ""όλα τα πράγματα για όλους τους ανθρώπους παντού"". Ίσως όμως και όχι, Στέφανε!",2020-12-06 07:25:00,https://www.news247.gr/img/4722/9071666/405000/w140/140/tsitsipas_harrods.jpg,ελλάδα,GRC
37, Βραζιλία: Πάνω από 43.000 νέα κρούσματα κορονοϊού ,Η ένταση της πανδημίας στη Βραζιλία παραμένει αμείωτη. Πάνω από 43000 τα νέα κρούσματα κορονοϊού στη χώρα. ,2020-12-05 23:50:00,https://www.news247.gr/img/2764/9069005/308000/w140/140/brazil.jpg,βραζιλία,BRA
38, Κορονοϊός - Αργεντινή: Έκτακτη εισφορά στους πολύ πλούσιους ,Τα πολύ μεγάλα πορτοφόλια της Αργεντινής καλούνται να βάλουν το χέρι στην τσέπη για να ενισχύσουν το δημόσιο της χώρας στη μάχη εναντίον του κορονοϊού. ,2020-12-05 23:03:00,https://www.news247.gr/img/9261/9039602/353000/w140/140/argentini.jpg,αργεντινή,ARG
31, Κορονοϊός - ΗΠΑ: Σχεδόν 2.500 θάνατοι το τελευταίο 24ωρο ,"Αύξηση κατά 214.099 παρουσίασαν τα νέα κρούσματα στις ΗΠΑ, σύμφωνα με τα Κέντρα Ελέγχου και Πρόληψης Νοσημάτων. ",2020-12-05 22:48:00,https://www.news247.gr/img/2051/9071996/317000/w140/140/usa051220.jpg,ελλάδα,GRC
18, Κορονοϊός - Γαλλία: Μείωση θανάτων το τελευταίο 24ωρο ,"Τις 55.000 αγγίζει ο συνολικός αριθμός των θανάτων στη Γαλλία, σύμφωνα με τις αρχές. ",2020-12-05 22:22:00,https://www.news247.gr/img/1619/9071960/581000/w140/140/france051220.jpg,γαλλία,FRA
11, Κορονοϊός - Ιταλία: Αισθητή μείωση σε θανάτους και κρούσματα ,Η Ιταλία εξακολουθεί να ταλαιπωρείται ιδιαίτερα από τον κορονοϊό αλλά τουλάχιστον είδε το Σάββατο τα νούμερα να μειώνονται. ,2020-12-05 21:47:00,https://www.news247.gr/img/9076/9053854/766000/w140/140/italy.jpg,ιταλία,ITA
13, Volkswagen: Η επένδυση στην Τουρκία ακυρώθηκε για πολιτικούς λόγους ,"Το πολιτικό κλίμα στην Τουρκία ""τρόμαξε"" τους μετόχους της Volksewagen και τελικά η επένδυση της εταιρίας στη χώρα ακυρώθηκε. ",2020-12-05 21:32:00,https://www.news247.gr/img/8707/7582351/043000/w140/140/volkswagen.jpg,τουρκία,TUR
1, Brexit: Συμφώνησαν ότι διαφωνούν Τζόνσον και Φον ντερ Λάιεν ,Μπόρις Τζόνσον και Ούρσουλα φον ντερ Λάιεν δεν μπορούν προσώρας να βρουν τη χρυσή τομή για το Brexit. ,2020-12-05 20:49:00,https://www.news247.gr/img/970/9026271/236000/w140/140/brexit.jpg,ελλάδα,GRC
2," Τουρκικό ΥΠΕΞ: ""Κακομαθημένο παιδί της ΕΕ η Ελλάδα"" ","""Καμία κύρωση δεν θα κάνει την Τουρκία να συμβιβαστεί ως προς τα κυριαρχικά της δικαιώματα στο Καστελόριζο"" αναφέρει μεταξύ άλλων το τουρκικό Υπουργείο Εξωτερικών.",2020-12-05 20:36:00,https://www.news247.gr/img/555/6719248/368000/w140/140/turkey040519.jpg,ελλάδα,GRC
3, Φλέγεται από τις διαδηλώσεις το Παρίσι- Συμπλοκές με τις αρχές και 22 συλλήψεις ,Το Παρίσι συγκλονίζεται από βίαιες διαδηλώσεις που διεξήχθησαν για να καταγγελθεί η αστυνομική ωμότητα αλλά και ο αμφιλεγόμενος νόμος για την ασφάλεια. ,2020-12-05 20:08:00,https://www.news247.gr/img/7006/9071782/860000/w140/140/parisi2.jpg,ελλάδα,GRC
4," Tο εξώφυλλο του Time πιάνει το νόημα για το 2020: ""Η χειρότερη χρονιά"" ","Το... διαπλανητικό συναίσθημα για το 2020 εξέφρασε το περιοδικό ""Time"" με το εξώφυλλο του τελευταίου τεύχους του. ",2020-12-05 19:58:00,https://www.news247.gr/img/3495/9071757/372000/w140/140/time051220.jpg,ελλάδα,GRC
5, Φρίκη στο Λος Άντζελες: 2 παιδιά βρέθηκαν αποκεφαλισμένα- Συνελήφθη ο πατέρας ,Η πυροσβεστική κλήθηκε να πάει σε σπίτι για πιθανή διαρροή αερίου αλλά εκεί βρέθηκε αντιμέτωπη με ένα αποτρόπαιο έγκλημα. ,2020-12-05 19:19:00,https://www.news247.gr/img/7290/9071741/652000/w140/140/police051220.jpg,ελλάδα,GRC
12, Υπεγράφη συμφωνία Ιταλίας - Λιβύης για συνεργασία στον αμυντικό τομέα ,"Συμφωνία στρατιωτικής συνεργασίας, τεχνικής φύσεως, υπέγραψαν στη Ρώμη οι υπουργοί Άμυνας της Ιταλίας και της Λιβύης. Η Ρώμη δίνει το μήνυμα ότι ενδιαφέρεται για την πρώην αποικία της.",2020-12-05 19:07:00,https://www.news247.gr/img/2410/9071735/366000/w140/140/italy.jpg,ιταλία,ITA
14, Τουρκία: Έκκληση των γιατρών για καθολικό lockdown- Σπάνε ρεκόρ τα κρούσματα ,"Οι Τούρκοι γιατροί πιστεύουν ότι η χώρα πρέπει να ""κλείσει"" για δύο εβδομάδες προκειμένου να καμφθεί το δεύτερο κύμα της πανδημίας του κορονοϊού. ",2020-12-05 19:00:00,https://www.news247.gr/img/8130/9058370/656000/w140/140/turkk.jpg,τουρκία,TUR
