,title,text,time,image,country,3let,countrycode
679," Εθνική Τράπεζα: Πτώση του ΑΕΠ κατά 2,1% το τέταρτο τρίμηνο ","Οι αναλυτές της Τράπεζας κάνουν λόγο για καλύτερη επίδοση το τρίτο τρίμηνο σε σχέση με τα δημοσιευμένα στοιχεία, τα οποία ενσωματώνουν μια έντονα αρνητική στατιστική προσαρμογή των στοιχείων του τουρισμού για εποχικότητα",2020-12-10 15:15:00,https://www.news247.gr/img/9103/8986597/685000/w140/140/ethniki.jpg,ελλάδα,,GR
680," Παγκρήτια Τράπεζα: Συμμετοχή στο νέο ""Εξοικονομώ-Αυτονομώ"" ",Το πρόγραμμα απευθύνεται σε πολύ ευρύτερο κοινό καθώς αναμένεται από αυτό να επωφεληθούν περί τις 60.000 κατοικίες ανά έτος.,2020-12-10 14:40:00,https://www.news247.gr/img/7253/7671136/833000/w140/140/pagkritia.jpg,ελλάδα,,GR
681, Γαλλία: Ο υπουργός Ευρωπαϊκών Υποθέσεων έκανε coming out ως γκέι ,"Ο Clément Beaune έκανε coming out ως γκέι. Υποσχέθηκε ότι θα υποστηρίξει την ΛΟΑΤΚΙ κοινότητα της Πολωνίας, που στιγματίζεται έντονα.",2020-12-10 14:39:00,https://www.news247.gr/img/7444/9076720/909000/w140/140/cl,γαλλία,,FR
682," Τράπεζα Πειραιώς: Συμμετοχή στο πρόγραμμα ""Εξοικονομώ-Αυτονομώ"" ","Η Τράπεζα Πειραιώς με ηγετική παρουσία στο «Εξοικονομώ Κατ΄Οίκον», έχει σχεδιάσει και προσφέρει στο νέο πρόγραμμα ένα ολοκληρωμένο πακέτο προϊόντων και υπηρεσιών στο πλαίσιο υποστήριξης των υφιστάμενων και νέων πελατών της.",2020-12-10 14:31:00,https://www.news247.gr/img/9757/7543292/755000/w140/140/peiraios.jpg,ελλάδα,,GR
683, Τράπεζα της Ελλάδος: Οριακές μεταβολές στα ενοίκια γραφείων-καταστημάτων ,"Το πρώτο εξάμηνο της χρονιάς τα μισθώματα γραφείων υποχώρησαν, σύμφωνα με την Τράπεζα της Ελλάδος κατά 1,6%, ενώ στα καταστήματα η πτώση έφτασε το 1%.",2020-12-10 14:07:00,https://www.news247.gr/img/9620/9076719/871000/w140/140/enoikiazetai.jpg,ελλάδα,,GR
684, Ιταλία-κορονοϊός: 4χρονο αγόρι είχε νοσήσει από το Νοέμβριο του 2019 ,"Νέα έρευνα αποκαλύπτει ότι ιός είχε εξαπλωθεί σε όλο τον κόσμο πριν γίνει γνωστός, αφού ένα παιδί στο Μιλάνο, εξακριβώθηκε ότι νόσησε από κορονοϊό ήδη από τον Νοέμβριο του 2019, χωρίς να έχει ταξιδέψει εκτός Ιταλίας. ",2020-12-10 14:03:00,https://www.news247.gr/img/1164/9076603/578000/w140/140/boy_mask.jpg,ιταλία,,IT
685," Ιταλία: ""Βούλιαξε"" και πάλι η Βενετία ","Η έντονη κακοκαιρία βρήκε απροετοίμαστους τους Ιταλούς. Δε λειτούργησε το σύστημα φραγμάτων, με αποτέλεσμα να δημιουργηθούν τεράστια προβλήματα.",2020-12-10 13:42:00,https://www.news247.gr/img/9804/9076669/773000/w140/140/venice.jpg,ιταλία,,IT
686, Ελληνικό κράνος του 7ου αιώνα π.Χ. εντοπίστηκε σε τάφο πολεμιστή στην Κροατία ,"Ελληνικό κράνος που χρησιμοποιήθηκε στους Περσικούς Πολέμους έφεραν στο φως αρχαιολόγοι στην Κροατία, μαζί με άλλα σπουδαία κειμήλια.",2020-12-10 12:00:00,https://www.news247.gr/img/1451/9076542/185000/w140/140/kranos.jpg,κροατία,,HR
687," Δολοφονία 25χρονου στην Αλβανία: ""Απαιτούμε δικαιοσύνη"" λέει ο πατέρας του ","Σε αναβρασμό βρίσκεται η γειτονική Αλβανία έπειτα από τη δολοφονία 25χρονου από σφαίρα αστυνομικού. ""Είμαστε άνθρωποι και απαιτούμε δικαιοσύνη. Πρέπει να λάβουν την τιμωρία που τους αξίζει"", υποστήριξε ο πατέρας του θύματος.",2020-12-10 11:45:00,https://www.news247.gr/img/2948/9076074/441000/w140/140/albania2.jpg,αλβανία,,AL
688, Lockdown: Πότε πληρώνονται όσοι τέθηκαν σε αναστολή τον Νοέμβριο ,"Το συνολικό ποσό που θα καταβληθεί ανέρχεται σε 251,668 εκ. ευρώ και αφορά 445.365 δικαιούχους. Τι αναφέρει ανακοίνωση του υπουργείου Εργασίας.",2020-12-10 11:39:00,https://www.news247.gr/img/6024/9076539/129000/w140/140/anastoli.jpg,ελλάδα,,GR
689, Ιαπωνία: Θα χρηματοδοτήσουν πρόγραμμα εύρεσης συντρόφου μέσω τεχνητής νοημοσύνης ,"Η χρηματοδότηση της ιαπωνικής κυβέρνησης στοχεύει στην αξιοποίηση προηγμένων συστημάτων ζευγαρώματος που θα λαμβάνουν υπόψη παράγοντες όπως χόμπι και αξίες, έχοντας ως στόχο την αύξηση των γεννήσεων στην χώρα.",2020-12-10 11:27:00,https://www.news247.gr/img/6833/9076497/018000/w140/140/japan.jpg,ιαπωνία,,JP
690, Αποκάλυψη που σοκάρει: Ο Τζονς Χόπκινς ήταν ιδιοκτήτης σκλάβων ,"Το πανεπιστήμιο, το οποίο υπήρξε εξαρχής στο προσκήνιο της πληροφόρησης για τον νέο κορονοϊό, ""υπερηφανεύτηκε"" για τον ιδρυτή που φέρεται να ήταν ιδιοκτήτης σκλάβων. ",2020-12-10 11:01:00,https://www.news247.gr/img/9092/9076410/443000/w140/140/hopkins.jpg,ελλάδα,,GR
691, Τράπεζα Πειραιώς: Συμμετοχή σε παγκόσμια πρωτοβουλία 38 τραπεζών για το κλίμα ,"Η τράπεζα συμμετέχει στη μεγαλύτερη διεθνή και φιλόδοξη πρωτοβουλία του τραπεζικού τομέα, που υποστηρίζει τη σταδιακή μετάβαση σε μια οικονομία μηδενικών εκπομπών έως το 2050.",2020-12-10 10:49:00,https://www.news247.gr/img/4764/9031014/053000/w140/140/peiraios.jpg,ελλάδα,,GR
692," Παραλήρημα από τον Μητροπολίτη Μόρφου: ""Ψηφιοποιημένη ταυτότητα"" τα εμβόλια ","Για ""νέα τάξη πραγμάτων"" κάνει λόγο ο Μητροπολίτης Μόρφου και ξεκαθαρίζει πως οι εκκλησίες της περιφέρειάς του δεν θα κλείσουν ούτε θα υπάρχει συγκεκριμένος αριθμός πιστών μέσα σε αυτές. Τι λέει για τα εμβόλια.",2020-12-10 10:31:00,https://www.news247.gr/img/5419/7495168/715000/w140/140/morfou.jpg,ελλάδα,,GR
693," Attica Bank: Συμμετοχή στο πρόγραμμα ""Εξοικονομώ – Αυτονομώ"" ","Η Attica Bank συνεχίζει τη συμμετοχή της στο Γ΄ Κύκλο του Προγράμματος Εξοικονόμηση Κατ΄ Οίκον ΙΙ, παρέχοντας δάνεια για την υλοποίηση των επιλέξιμων παρεμβάσεων με ευνοϊκούς όρους.",2020-12-10 10:30:00,https://www.news247.gr/img/3615/9059868/907000/w140/140/atticabank.jpg,ελλάδα,,GR
694, Κορονοϊός-Βέλγιο: Μεγάλη απάτη με ψεύτικες νοσοκόμες ,"Οι αρχές του Βελγίου προειδοποιούν για καλοστημένη απάτη, στις μέρες του κορονοϊού. Μία νοσοκόμα κάνει τεστ στο θύμα στο μπάνιο, ενώ η δεύτερη νοσοκόμα ψάχνει στο υπόλοιπο σπίτι για χρήματα και τιμαλφή. ",2020-12-10 10:27:00,https://www.news247.gr/img/1866/9076437/531000/w140/140/nurse.jpg,βέλγιο,,BE
695, Τα όρια της έκθεσης Πισσαρίδη και η ανάγκη να μιλήσουμε σοβαρά για το ρόλο της εργασίας ,Ο πρώην γενικός γραμματέας του ΣΕΠΕ Πάνος Κορφιάτης γράφει στο NEWS 24/7 για το πως αντιμετωπίζει η έκθεση Πισσαρίδη την εργασία και τη μετάβαση στην ψηφιακή εποχή. ,2020-12-10 09:53:00,https://www.news247.gr/img/220/9075007/939000/w140/140/ergates.jpg,ελλάδα,,GR
696, Τζορτζ Φλόιντ: Η έφηβη που κατέγραψε τη δολοφονία του τιμήθηκε με βραβείο θάρρους ,"Χωρίς την παρουσία και το μυαλό της 17χρονης Darnella, όπως και το ρίσκο να διακινδυνεύσει τη δική της ασφάλεια, ίσως να μην γνωρίζαμε ποτέ την αλήθεια για τη δολοφονία του Τζορτζ Φλόιντ. ",2020-12-10 08:03:00,https://www.news247.gr/img/572/9076336/349000/w140/140/darnella-frazier-.jpg,ελλάδα,,GR
697, Δολοφονία 25χρονου στην Αλβανία: Απενεργοποιημένες οι κάμερες στη στολή του αστυνομικού ,"Απενεργοποιημένη ήταν η κάμερα του αστυνομικού που δολοφόνησε εν ψυχρώ των 25χρονο Klodian Rasha, με αποτέλεσμα ο φόνος να μην καταγραφεί. Θύελλα αντιδράσεων σε όλη τη χώρα.",2020-12-10 07:46:00,https://www.news247.gr/img/8410/9076327/676000/w140/140/alb.jpg,αλβανία,,AL
698, Τράπεζα Πειραιώς: Εγκρίνεται το Σχέδιο Μετασχηματισμού από τη Γενική Συνέλευση ,Προβλέπει απόσχιση και εισφορά της τραπεζικής δραστηριότητας σε νέα εταιρεία. Σε Συμμετοχών μετατρέπεται η εισηγμένη. Ποιες συμμετοχές θα διατηρήσει. Τι γίνεται με τα δικαιώματα των εργαζομένων.,2020-12-10 07:32:00,https://www.news247.gr/img/8586/9076249/336000/w140/140/peiraivs.jpg,ελλάδα,,GR
699, Μέσω του Ταμείου Ανάκαμψης η Διπλή Ανάπλαση σε Βοτανικό και Αλεξάνδρας ,"Αναλυτικά τα έργα υποδομών και ενέργειας στη χώρα, τα οποία προτείνονται προς ένταξη στο Ταμείο Ανάκαμψης.",2020-12-10 06:25:00,https://www.news247.gr/img/6039/9076132/692000/w140/140/votanikos091220.jpg,ελλάδα,,GR
700, Ακίνητα: Μείωση εισοδήματος για 90.000 ιδιοκτήτες ,Με μείωση του εισοδήματος χωρίς αντιστάθμισμα κινδυνεύουν περίπου 90.000 ιδιοκτήτες με μειωμένα ενοίκια. ,2020-12-10 06:07:00,https://www.news247.gr/img/6339/9076312/414000/w140/140/akinhta.jpg,ελλάδα,,GR
701, Γερμανία: Όλα έτοιμα για τους μαζικούς εμβολιασμούς ,Πάνω από 8 εκατομμύρια πολίτες αναμένεται να κάνουν το εμβόλιο κατά του κορονοϊού στη Γερμανία. ,2020-12-10 02:26:00,https://www.news247.gr/img/4049/9076172/608000/w140/140/germany.jpg,γερμανία,,DE
702, Ιστορική απόφαση: Ο ΟΗΕ δεν θεωρεί την κάνναβη επικίνδυνη ,"Η απόφαση-ορόσημο του ΟΗΕ αφαιρεί την κάνναβη από τον κατάλογο των επικίνδυνων ουσιών, εκσυγχρονίζοντας το ρυθμιστικό πλαίσιο και ανοίγοντας τον δρόμο στην ανάπτυξη της φαρμακευτικής κάνναβης.",2020-12-10 01:57:00,https://www.news247.gr/img/9329/9075640/638000/w140/140/cannabis.jpg,ελλάδα,,GR
703, Brexit: Συνεχίζεται το αδιέξοδο - Αποχώρησε ο Τζόνσον από τις Βρυξέλλες ,Χωρίς συμφωνία αποχώρησε ο Τζόνσον από τις Βρυξέλλες - Οι συνομιλίες θα συνεχιστούν την Κυριακή. ,2020-12-10 01:30:00,https://www.news247.gr/img/2364/9076273/660000/w140/140/brexit.jpg,ελλάδα,,GR
704, Κυβερνοεπίθεση στον Ευρωπαϊκό Οργανισμό Φαρμάκων με στόχο το εμβόλιο της Pfizer ,Κυβερνοεπίθεση σημειώθηκε στον Ευρωπαϊκό Οργανισμό Φαρμάκων με αποτέλεσμα να υποκλαπούν έγγραφα του εμβολίου της Pfizer. ,2020-12-09 23:46:00,https://www.news247.gr/img/7831/9076146/694000/w140/140/emvolio.jpg,ελλάδα,,GR
705, Αλβανία: Κύμα οργής και σφοδρές συγκρούσεις μετά τη δολοφονία 25χρονου από αστυνομικό ,Εκατοντάδες Αλβανοί βγήκαν στους δρόμους των Τιράνων ζητώντας δικαιοσύνη για τον θάνατο του 25χρονου Klodian Rasha. Βίαια επεισόδια στο κέντρο της πόλης.,2020-12-09 21:53:00,https://www.news247.gr/img/8386/9076073/450000/w140/140/albania1.jpg,αλβανία,,AL
706, ΗΑΕ: Κατά 86% αποτελεσματικό το εμβόλιο κορονοϊού της Κίνας ,Τα ΗΑΕ μεταδίδουν πως το εμβόλιο κατά του κορονοϊού της Εθνικής Φαρμακευτικής Ομάδας της Κίνας είναι αποτελεσματικό κατά 86%. Δεν έχουν κυκλοφορήσει λεπτομερή στοιχεία της κλινικής δοκιμής.,2020-12-09 21:46:00,https://www.news247.gr/img/2351/9076031/277000/w140/140/embolio.jpg,κίνα,,CN
707, Νέα αλλαγή δεδομένων: Ο κορονοϊός ήταν στην Ιταλία από τον Νοέμβριο του 2019 ,"Όλο και νωρίτερα φέρνουν τον κορονοϊό στην Ιταλία μελέτες. Σύμφωνα με την πιο πρόσφατη, είχε φτάσει και είχε αρχίσει να διασπείρεται, τρεις μήνες νωρίτερα από την πρώτη επίσημη καταγραφή κρούσματος. ",2020-12-09 20:59:00,https://www.news247.gr/img/8100/9076045/823000/w140/140/milano091220.jpg,ιταλία,,IT
708, Χρ. Μεγάλου: Τα 32 δισ. του Ταμείου Ανάκαμψης θα επιτρέψουν ρυθμό ανάπτυξης άνω του 3% ,Οι εισροές πόρων από το Ταμείο Ανάκαμψης θα επιτρέψουν στη χώρα να επιτύχει ρυθμούς ανάπτυξης άνω του 3% του ΑΕΠ μεσοπρόθεσμα. Οι κινήσεις της Τράπεζας Πειραιώς για τη στήριξη της οικονομίας.,2020-12-09 20:53:00,https://www.news247.gr/img/4258/9076047/889000/w140/140/megalou.jpg,ελλάδα,,GR
709," ""Πήρε μπόι"" το Έβερεστ: Ψήλωσε κατά σχεδόν ένα μέτρο ","Ποιος ο λόγος, σύμφωνα με τους επιστήμονες, που το ψηλότερο σημείο της Γης, το Έβερεστ, ψήλωσε κατά 0,86 μέτρα. ",2020-12-09 20:40:00,https://www.news247.gr/img/8593/9076020/782000/w140/140/everest091220.jpg,ελλάδα,,GR
710, Κορονοϊός: Ο Καναδάς ενέκρινε το εμβόλιο της Pfizer ,"Η ρυθμιστική αρχή υγείας του Καναδά έδωσε το ""πράσινο φως"" για την έναρξη των εμβολιασμών με το εμβόλιο της Pfizer. Την επόμενη βδομάδα η χορήγηση.",2020-12-09 20:25:00,https://www.news247.gr/img/6099/9076008/366000/w140/140/pfizer.jpg,καναδάς,,CA
711, Αυτό είναι το μεγαλύτερο παγόβουνο που έχει καταγραφεί ποτέ ,Το θηριώδες παγόβουνο έχει επιφάνεια περίπου 4.200 τετραγωνικών χιλιομέτρων και κατευθύνεται προς το νησί της Νότιας Γεωργίας.,2020-12-09 20:11:00,https://www.news247.gr/img/8649/9075917/155000/w140/140/pagovouno.jpg,ελλάδα,,GR
712, Ιταλία: Φωταγωγήθηκε το μεγαλύτερο χριστουγεννιάτικο δέντρο στον κόσμο ,Το δέντρο ύψους 750 μέτρων είναι φτιαγμένο με φωτάκια που απλώνονται πάνω στην πλαγιά του βουνού Ιντζίνο.,2020-12-09 19:48:00,https://www.news247.gr/img/9510/9075984/497000/w140/140/tree.jpg,ιταλία,,IT
713, Pornhub: Μεγάλες αλλαγές μετά τις κατηγορίες για παράνομο περιεχόμενο ,Έρευνα των NYT κατηγορεί το Pornhub για περιεχόμενο σχετικό με παιδική κακοποίηση και βιασμούς. Τι απαντά η ιστοσελίδα και σε ποιες ενέργειες προχωρά.,2020-12-09 19:37:00,https://www.news247.gr/img/536/9075979/220000/w140/140/pornhub.jpg,ελλάδα,,GR
714, Κατέρρευσε γέφυρα ρίχνοντας τις υποψήφιες Μις Ταϊλάνδη σε βρώμικη λίμνη ,"Ατύχημα για 30 υποψήφιες των φετινών καλλιστείων της Ταϊλάνδης. Πόζαραν σε κρεμαστή γέφυρα, αλλά κατέρρευσε και έπεσαν σε λίμνη. Υπήρξαν μικροί τραυματισμοί.",2020-12-09 18:10:00,https://www.news247.gr/img/2460/9075889/055000/w140/140/tailandi.jpg,ταϊλάνδη,,TH
715, Reuters: Πιθανή διεύρυνση κυρώσεων κατά της Τουρκίας στο προσχέδιο των συμπερασμάτων ,Κυρώσεις σε περισσότερα νομικά και φυσικά πρόσωπα περιλαμβάνει το προσχέδιο των συμπερασμάτων της Συνόδου Κορυφής ,2020-12-09 16:44:00,https://www.news247.gr/img/9855/9057604/063000/w140/140/oruc.jpg,τουρκία,,TR
716, Ερρίφθη ο κύβος για κυρώσεις σε Τουρκία από ΗΠΑ για τους S - 400 ,Διπλωματικές πηγές αναφέρουν ότι το σχέδιο του Αμερικανικού Αμυντικού Προϋπολογισμού για το 2021 περιέχει σημαντικές διατάξεις ελληνικού ενδιαφέροντος.,2020-12-09 16:21:00,https://www.news247.gr/img/1042/9075815/479000/w140/140/s400.jpg,τουρκία,,TR
717," Εμβόλιο Pfizer: ""Απαγορευτικό για όσους έχουν αλλεργίες"" ",Αυστηρή σύσταση για όσους έχουν αλλεργίες εξέδωσαν οι βρετανικές αρχές μετά τις αλλεργικές αντιδράσεις που προκλήθηκαν σε δύο υγειονομικούς από το εμβόλιο,2020-12-09 16:13:00,https://www.news247.gr/img/9107/9074629/517000/w140/140/emvoliasmos.jpg,ελλάδα,,GR
718, Αναδείχθηκαν οι κορυφαίες βομηχανίες της Ελλάδας από τα Manufacturing Excellence Awards 2020 ,Ηχηρά ονόματα της ελληνικής βιομηχανίας αλλά και κάποιες μικρότερες μεταποιητικές επιχειρήσεις γίνονται πρωταγωνιστές και κερδίζουν βραβεία για δράσεις στο πλαίσιο της λειτουργίας των επιχειρήσεών τους.,2020-12-09 14:17:00,https://www.news247.gr/img/326/9075698/135000/w140/140/awards1.jpg,ελλάδα,,GR
719, Αυξήθηκαν κατά 500.000 οι φορολογούμενοι που χρωστούν στην εφορία ,Τον Οκτώβριο οι απλήρωτοι φόροι έφτασαν στα 670 εκατομμύρια ευρώ. Σε δυσθεώρατο ποσό τα συνολικά φέσια προς το δημόσιο.,2020-12-09 14:07:00,https://www.news247.gr/img/73/9075681/337000/w140/140/eforia.jpg,ελλάδα,,GR
720," Ο Ερντογάν προκαλεί την ΕΕ: ""Δε μας νοιάζουν οι κυρώσεις - Η Ελλάδα αποφεύγει τον διάλογο"" ","Επιμένει στην προκλητική ρητορική του ο Ρετζέπ Ταγίπ Ερντογάν. Καλεί σε ""συνεργασία για εύρεση αμοιβαίας λύσης"", χωρίς ωστόσο να υποχωρεί στις διεκδικήσεις του σε Αιγαίο και Μεσόγειο. ",2020-12-09 13:25:00,https://www.news247.gr/img/2270/9063697/291000/w140/140/erdogan.jpg,ελλάδα,,GR
721, Βρετανία: 19χρονος δολοφόνησε 15χρονο για να μην αποκαλύψει τη σχέση τους ,"Φρίκη στη Βρετανία. Ο 19χρονος Μάθιου Μάσον σκότωσε με γαλλικό κλειδί 15χρονο, ώστε να μη μαθευτεί ότι είχαν ερωτική σχέση. ",2020-12-09 12:41:00,https://www.news247.gr/img/5150/9075545/818000/w140/140/matthew.jpg,ελλάδα,,GR
722, Πολωνία: Κρατικό διυλιστήριο πετρελαίου αγοράζει ΜΜΕ - Φόβοι για την ελευθεροτυπία ,"Θύελλα αντιδράσεων έχει προκαλέσει στην Πολωνία, η εξαγορά μεγάλου ιδιωτικού ομίλου ΜΜΕ από κρατικό διυλιστήριο πετρελαίου. Για ""σκοτεινή μέρα"" κάνει λόγο η αντιπολίτευση.",2020-12-09 11:56:00,https://www.news247.gr/img/4794/9075477/454000/w140/140/poland.jpg,πολωνία,,PL
723," Ο ιός είναι οικουμενικός, το εμβόλιο όχι ","Από τα εμβόλια που έχει ανακοινωθεί η αποτελεσματικότητά τους, σχεδόν όλες οι διαθέσιμες δόσεις έχουν αποκτηθεί από τις δυτικές χώρες με κίνδυνο το 80% του παγκόσμιου πληθυσμού να μην εμβολιαστεί μέσα στο 2021. ",2020-12-09 11:25:00,https://www.news247.gr/img/3211/9075513/864000/w140/140/corona1.jpg,ελλάδα,,GR
724, Ann Marie: Η τραγουδίστρια της R&B κατηγορείται ότι πυροβόλησε τον σύντροφό της στο κεφάλι ,"Η τραγουδίστρια ισχυρίστηκε ότι το όπλο εκπυρσοκρότησε, πέφτοντας από το τραπέζι, τραυματίζοντας τον σύντροφό της. Ο άνδρας νοσηλεύεται σε κρίσιμη κατάσταση.",2020-12-09 10:34:00,https://www.news247.gr/img/5531/9075432/234000/w140/140/ann_marie.jpg,ελλάδα,,GR
725, Μυστήριο στην Ινδία: Ίχνη μολύβδου και νικελίου στο αίμα 505 ασθενών ,"Αντιμέτωπη με μία μυστηριώδη ασθένεια που έχει οδηγήσει εκατοντάδες ανθρώπους στο νοσοκομείο και σε έναν θάνατο είναι η Ινδία. Επιληπτικές κρίσεις, απώλεια συνείδησης και ναυτία μεταξύ των συμπτωμάτων.",2020-12-09 08:40:00,https://www.news247.gr/img/5479/9075329/399000/w140/140/india.jpg,ινδία,,ΙΝ
726, Στο ''σφυρί'' βγαίνει σήμερα η βίλα του Π. Ψυχάρη στο Ψυχικό ,"Η τιμή πρώτης προσφοράς έχει ορισθεί στα 2,4 εκατ ευρώ και η επισπεύδουσα τράπεζα είναι η Alpha Bank. Το ακίνητο συγκεντρώνει ισχυρό επενδυτικό ενδιαφέρον από εταιρείες και ιδιώτες.",2020-12-09 07:14:00,https://www.news247.gr/img/7439/9075266/905000/w140/140/bila.jpg,ελλάδα,,GR
